{
  "eventId": "10000000-0000-4000-8000-000000000004",
  "eventType": "loan.evidence.updated.v1",
  "schemaVersion": "1.0.0",
  "occurredAt": "2026-01-15T09:05:00+09:00",
  "producer": "loan-service",
  "caseId": "case-1001",
  "correlationId": "loan-1001",
  "causationId": "10000000-0000-4000-8000-000000000003",
  "payload": { "applicationId": "loan-1001", "decisionCaseId": "case-1001", "inputSnapshotVersion": "snapshot-v2", "evidenceRefs": ["evidence://transaction-explanation/1"] }
}
