{
  "eventId": "10000000-0000-4000-8000-000000000007",
  "eventType": "loan.decision.commanded.v1",
  "schemaVersion": "1.0.0",
  "occurredAt": "2026-01-15T09:07:00+09:00",
  "producer": "governance-service",
  "caseId": "case-1001",
  "correlationId": "loan-1001",
  "causationId": "10000000-0000-4000-8000-000000000006",
  "payload": { "commandId": "50000000-0000-4000-8000-000000000001", "decisionCaseId": "case-1001", "applicationId": "loan-1001", "decisionId": "40000000-0000-4000-8000-000000000001", "finalDecision": "APPROVE", "assuranceResult": "ASSURANCE_COMPLETE" }
}
