{
  "eventId": "10000000-0000-4000-8000-000000000106", "eventType": "agent.evaluation.completed.v1", "schemaVersion": "1.0.0", "occurredAt": "2026-01-15T09:02:01+09:00", "producer": "governance-service", "caseId": "case-1001", "correlationId": "loan-1001", "causationId": "10000000-0000-4000-8000-000000000105",
  "payload": { "evaluationRunId": "30000000-0000-4000-8000-000000000001", "decisionCaseId": "case-1001", "evaluationMode": "MOCK", "evaluatorId": "mock-evaluator", "decisionEnvelope": { "schemaVersion": "1.0.0", "decisionId": "40000000-0000-4000-8000-000000000101", "evaluationRunId": "30000000-0000-4000-8000-000000000001", "decisionCaseId": "case-1001", "evaluatorId": "mock-evaluator", "originalPurpose": "LOAN_ELIGIBILITY_ASSESSMENT", "subjectType": "LOAN_APPLICATION", "proposal": "PROPOSE_APPROVE", "status": "PROPOSED", "confidence": 0.88, "usedEvidenceRefs": ["snapshot://loan-1001/v2"], "generatorRef": { "agentName": "mock-evaluator", "agentVersion": "mock-evaluator-v1", "modelName": "loan-decision-model", "modelVersion": "mock-v1", "promptName": "loan-decision-prompt", "promptVersion": "mock-prompt-v1" }, "validUntil": "2026-01-16T09:02:01+09:00" } }
}
